{
  "record_type": "evidence_record",
  "schema_version": "0.1.0",
  "record_version": "1.0.0",
  "artifact_id": "CAL-EVIDENCE-001",
  "packet_ref": {
    "packet_id": "CAL-PACKET-001",
    "record_version": "1.3.0",
    "hashes": [
      {
        "algorithm": "sha256",
        "digest": "1288c636347affbafaa6d78b9bd67f337cb2b9c3f3ec2103225f73c7506ef0b7"
      }
    ]
  },
  "run_ref": {
    "run_id": "CAL-RUN-PRODUCER-001",
    "record_version": "1.0.0",
    "hashes": [
      {
        "algorithm": "sha256",
        "digest": "06591cbb541a7d160863279f98bcda65014264532723691eb6aa0cd36eea1d98"
      }
    ]
  },
  "status": "complete",
  "evidence_kind": "mathematical_argument",
  "created_at": "2026-08-07T17:36:00Z",
  "artifact_path": "work/CAL-PACKET-001/odd-sum-proof.md",
  "media_type": "text/markdown",
  "byte_size": 489,
  "hashes": [
    {
      "algorithm": "sha256",
      "digest": "b59df765f4e03a7bb69a9f876d3cb00399d91a72fe04e4e4a1a88ad98c31d8ee"
    }
  ],
  "source_record_ids": [
    "CAL-SOURCE-001"
  ],
  "claims_supported": [
    {
      "claim_id": "CAL-CLAIM-ODD-SUM",
      "claim_version": "1.0.0",
      "relationship": "supports"
    }
  ],
  "method_summary": "Rewrite each odd summand as two times its index minus one, then use the finite arithmetic-series identity and check the empty-sum case separately.",
  "dependency_artifacts": [],
  "checks": [
    {
      "check_id": "CAL-EVIDENCE-CHECK-ALGEBRA",
      "method": "Manual term-by-term reconstruction of the displayed algebra.",
      "status": "passed",
      "receipt_artifact_ids": [],
      "notes": "For n at least one, twice n(n+1)/2 minus n simplifies to n squared."
    },
    {
      "check_id": "CAL-EVIDENCE-CHECK-BOUNDARY",
      "method": "Direct evaluation at n equals zero.",
      "status": "passed",
      "receipt_artifact_ids": [],
      "notes": "The empty sum and zero squared are both zero."
    }
  ],
  "reproducibility": {
    "level": "replayable",
    "instructions": [
      "Read only the frozen statement and proof artifact.",
      "Recompute the finite-sum simplification without relying on private producer context.",
      "Check n equals zero separately."
    ],
    "clean_environment_status": "not_applicable",
    "independently_reproduced": false,
    "review_binding": "exact_transition_refs"
  },
  "formalization": {
    "artifact_role": "not_formal",
    "formal_status": "not_applicable",
    "statement_correspondence_status": "not_applicable",
    "formal_systems": [],
    "trust_base": [],
    "placeholder_status": "not_applicable",
    "formal_acceptance_establishes_statement_correspondence": false
  },
  "submission_boundary": {
    "private_by_default": true,
    "schema_fields_are_public_allowlist": true,
    "allowlisted_artifact_ids": [
      "CAL-EVIDENCE-001"
    ],
    "excluded_from_submission_by_default": {
      "raw_transcript": true,
      "prompt_history": true,
      "chain_of_thought": true,
      "private_notes": true,
      "unpublished_communications": true,
      "personal_context": true,
      "credentials": true,
      "unrelated_local_files": true
    },
    "raw_interaction_records_required": false,
    "redaction_status": "passed",
    "publication_preview_status": "approved",
    "retention_rule": "approved_submission_only"
  },
  "submission_rights": {
    "commons_originated_record": true,
    "dedication": "CC0-1.0",
    "dedication_scope": "intentionally_submitted_commons_components_only",
    "submitted_component_ids": [
      "CAL-EVIDENCE-001"
    ],
    "third_party_rights_preserved": true,
    "third_party_source_ids": [
      "CAL-SOURCE-001"
    ],
    "redistribution_status": "permitted"
  },
  "limitations": {
    "status": "known",
    "items": [
      "This is an elementary workflow calibration artifact and makes no novelty, priority, open-problem, or model-capability claim."
    ]
  }
}
